[
  {
    "cache_mb": null,
    "capacity_gb": 2000,
    "category": "sshd",
    "enrichment_evidence": [],
    "form_factor": "2.5\"",
    "general_product_information__adorama_sku": null,
    "general_product_information__amazon_sku": null,
    "general_product_information__bestbuy_sku": null,
    "general_product_information__hyte_sku": null,
    "general_product_information__ibuypower_sku": null,
    "general_product_information__lttstore_sku": null,
    "general_product_information__manufacturer_url": null,
    "general_product_information__newegg_sku": null,
    "general_product_information__walmart_sku": null,
    "identifiers__identifiers": [
      {
        "type": "mpn",
        "value": "LX001",
        "region": "all"
      },
      {
        "type": "mpn",
        "value": "ST2000LXZ01",
        "region": "all"
      }
    ],
    "identifiers__retailer_listings": [],
    "identifiers__version": 1,
    "inherited_fields": [],
    "interface": "SATA 6.0 Gb/s",
    "interface_family": "SATA",
    "lighting": [],
    "manufacturer": "Seagate",
    "manufacturer_url": null,
    "manufacturer_verified_fields": [],
    "metadata__last_manually_spec_verified_at": null,
    "metadata__manufacturer": "Seagate",
    "metadata__name": "Seagate FireCuda Compute 2TB Hybrid 2.5\" 5400 RPM SATA",
    "metadata__part_numbers": [
      "ST2000LXZ01",
      "LX001"
    ],
    "metadata__release_year": null,
    "metadata__series": "FireCuda",
    "metadata__variant": "2000GB",
    "name": "Seagate FireCuda Compute 2TB Hybrid 2.5\" 5400 RPM SATA",
    "nvme": false,
    "part_id": "097f4884-ad64-4c84-bec3-f81f83116e6b",
    "pipeline_version": "1.1.0",
    "quality_issue_codes": [],
    "quality_status": "no_issues_detected",
    "source_category": "storage_other",
    "source_commit": "3e1f527bef5ee94596a947e70a38bdaa90417592",
    "source_record": "01_raw/buildcores/Storage/097f4884-ad64-4c84-bec3-f81f83116e6b.json",
    "source_weight_g": null,
    "storage_type": "SSHD"
  },
  {
    "cache_mb": null,
    "capacity_gb": 1000,
    "category": "sshd",
    "enrichment_evidence": [],
    "form_factor": "2.5\"",
    "general_product_information__adorama_sku": null,
    "general_product_information__amazon_sku": null,
    "general_product_information__bestbuy_sku": null,
    "general_product_information__hyte_sku": null,
    "general_product_information__ibuypower_sku": null,
    "general_product_information__lttstore_sku": null,
    "general_product_information__manufacturer_url": null,
    "general_product_information__newegg_sku": null,
    "general_product_information__walmart_sku": null,
    "identifiers__identifiers": [
      {
        "type": "ean",
        "value": "0132018246900",
        "region": "all"
      },
      {
        "type": "mpn",
        "value": "WD1001X06XDTL",
        "region": "all"
      },
      {
        "type": "upc",
        "value": "014444446959",
        "region": "all"
      }
    ],
    "identifiers__retailer_listings": [
      {
        "source": "amazon",
        "channel": "au",
        "source_product_id": "B00GSJ9X4Q",
        "pricing_enabled": true,
        "verified": true
      },
      {
        "source": "amazon",
        "channel": "be",
        "source_product_id": "B00GSJ9X4Q",
        "pricing_enabled": true,
        "verified": true
      },
      {
        "source": "amazon",
        "channel": "ca",
        "source_product_id": "B00GSJ9X4Q",
        "pricing_enabled": true,
        "verified": true
      },
      {
        "source": "amazon",
        "channel": "de",
        "source_product_id": "B00GSJ9X4Q",
        "pricing_enabled": true,
        "verified": true
      },
      {
        "source": "amazon",
        "channel": "es",
        "source_product_id": "B00GSJ9X4Q",
        "pricing_enabled": true,
        "verified": true
      },
      {
        "source": "amazon",
        "channel": "fr",
        "source_product_id": "B00GSJ9X4Q",
        "pricing_enabled": true,
        "verified": true
      },
      {
        "source": "amazon",
        "channel": "ie",
        "source_product_id": "B00GSJ9X4Q",
        "pricing_enabled": true,
        "verified": true
      },
      {
        "source": "amazon",
        "channel": "it",
        "source_product_id": "B00GSJ9X4Q",
        "pricing_enabled": true,
        "verified": true
      },
      {
        "source": "amazon",
        "channel": "jp",
        "source_product_id": "B00GSJ9X4Q",
        "pricing_enabled": true,
        "verified": true
      },
      {
        "source": "amazon",
        "channel": "nl",
        "source_product_id": "B00GSJ9X4Q",
        "pricing_enabled": true,
        "verified": true
      },
      {
        "source": "amazon",
        "channel": "pl",
        "source_product_id": "B00GSJ9X4Q",
        "pricing_enabled": true,
        "verified": true
      },
      {
        "source": "amazon",
        "channel": "se",
        "source_product_id": "B00GSJ9X4Q",
        "pricing_enabled": true,
        "verified": true
      },
      {
        "source": "amazon",
        "channel": "sg",
        "source_product_id": "B00GSJ9X4Q",
        "pricing_enabled": true,
        "verified": true
      },
      {
        "source": "amazon",
        "channel": "uk",
        "source_product_id": "B00GSJ9X4Q",
        "pricing_enabled": true,
        "verified": true
      },
      {
        "source": "amazon",
        "channel": "us",
        "source_product_id": "B00GSJ9X4Q",
        "pricing_enabled": true,
        "verified": true
      }
    ],
    "identifiers__version": 1,
    "inherited_fields": [],
    "interface": "SATA 6.0 Gb/s",
    "interface_family": "SATA",
    "lighting": [],
    "manufacturer": "Western Digital",
    "manufacturer_url": null,
    "manufacturer_verified_fields": [],
    "metadata__last_manually_spec_verified_at": null,
    "metadata__manufacturer": "Western Digital",
    "metadata__name": "Western Digital Black2 1TB Hybrid 2.5\" 5400RPM SATA",
    "metadata__part_numbers": [
      "WD1001X06XDTL"
    ],
    "metadata__release_year": null,
    "metadata__series": "Black2",
    "metadata__variant": "1000GB",
    "name": "Western Digital Black2 1TB Hybrid 2.5\" 5400RPM SATA",
    "nvme": false,
    "part_id": "1259f142-0aa8-4ae8-ba58-6a3e24b1d437",
    "pipeline_version": "1.1.0",
    "quality_issue_codes": [],
    "quality_status": "no_issues_detected",
    "source_category": "storage_other",
    "source_commit": "3e1f527bef5ee94596a947e70a38bdaa90417592",
    "source_record": "01_raw/buildcores/Storage/1259f142-0aa8-4ae8-ba58-6a3e24b1d437.json",
    "source_weight_g": null,
    "storage_type": "SSHD"
  },
  {
    "cache_mb": null,
    "capacity_gb": 2000,
    "category": "sshd",
    "enrichment_evidence": [],
    "form_factor": "3.5\"",
    "general_product_information__adorama_sku": null,
    "general_product_information__amazon_sku": null,
    "general_product_information__bestbuy_sku": null,
    "general_product_information__hyte_sku": null,
    "general_product_information__ibuypower_sku": null,
    "general_product_information__lttstore_sku": null,
    "general_product_information__manufacturer_url": null,
    "general_product_information__newegg_sku": null,
    "general_product_information__walmart_sku": null,
    "identifiers__identifiers": [
      {
        "type": "ean",
        "value": "0763649110270",
        "region": "all"
      },
      {
        "type": "ean",
        "value": "0763649118023",
        "region": "all"
      },
      {
        "type": "ean",
        "value": "3660619400379",
        "region": "all"
      },
      {
        "type": "mpn",
        "value": "ST2000DX002",
        "region": "all"
      },
      {
        "type": "mpn",
        "value": "ST2000DXB02",
        "region": "all"
      },
      {
        "type": "upc",
        "value": "763649110270",
        "region": "all"
      },
      {
        "type": "upc",
        "value": "763649118023",
        "region": "all"
      }
    ],
    "identifiers__retailer_listings": [
      {
        "source": "amazon",
        "channel": "au",
        "source_product_id": "B01IEKG2HM",
        "pricing_enabled": true,
        "verified": true
      },
      {
        "source": "amazon",
        "channel": "be",
        "source_product_id": "B01IEKG2HM",
        "pricing_enabled": true,
        "verified": true
      },
      {
        "source": "amazon",
        "channel": "ca",
        "source_product_id": "B01IEKG2HM",
        "pricing_enabled": true,
        "verified": true
      },
      {
        "source": "amazon",
        "channel": "de",
        "source_product_id": "B01IEKG2HM",
        "pricing_enabled": true,
        "verified": true
      },
      {
        "source": "amazon",
        "channel": "es",
        "source_product_id": "B01IEKG2HM",
        "pricing_enabled": true,
        "verified": true
      },
      {
        "source": "amazon",
        "channel": "fr",
        "source_product_id": "B01IEKG2HM",
        "pricing_enabled": true,
        "verified": true
      },
      {
        "source": "amazon",
        "channel": "ie",
        "source_product_id": "B01IEKG2HM",
        "pricing_enabled": true,
        "verified": true
      },
      {
        "source": "amazon",
        "channel": "it",
        "source_product_id": "B01IEKG2HM",
        "pricing_enabled": true,
        "verified": true
      },
      {
        "source": "amazon",
        "channel": "jp",
        "source_product_id": "B01IEKG2HM",
        "pricing_enabled": true,
        "verified": true
      },
      {
        "source": "amazon",
        "channel": "nl",
        "source_product_id": "B01IEKG2HM",
        "pricing_enabled": true,
        "verified": true
      },
      {
        "source": "amazon",
        "channel": "pl",
        "source_product_id": "B01IEKG2HM",
        "pricing_enabled": true,
        "verified": true
      },
      {
        "source": "amazon",